{"delta":null,"hash":"641590f25e15aac702539b61bca8ab5fc6120aad","metric":40.6266,"run":0,"short_hash":"641590f","status":"baseline","summary":"Initial baseline: BN_dim=2, hidden=8, wide=64, epochs=80, lr=1e-3, 5 seeds","timestamp":"2026-04-03T03:07:30.871886+00:00"}
{"delta":-0.6598000000000042,"hash":"02220f18b60861d745d4017518a38a51607d690b","metric":39.9668,"run":1,"short_hash":"02220f1","status":"discarded","summary":"Reduced epochs 80→40. BN I_eff doubled but Wide also improved. Net ratio slightly worse.","timestamp":"2026-04-03T03:08:13.231574+00:00"}
{"delta":-40.6266,"hash":"444bb063ff8460f2540826f22e2486704636dbaa","metric":0.0,"run":2,"short_hash":"444bb06","status":"discarded","summary":"N_NOISE=12. Gate fail: A(BN)=0.80 < 0.9. Too much noise for bottleneck to handle.","timestamp":"2026-04-03T03:09:03.939882+00:00"}
{"delta":-40.6266,"hash":"605a2fa5bede8369428e6df91db48ac193040794","metric":0.0,"run":3,"short_hash":"605a2fa","status":"discarded","summary":"N_NOISE=8. A(BN)=0.89, just below gate. Need wider encoder.","timestamp":"2026-04-03T03:09:53.057249+00:00"}
{"delta":110.81730000000002,"hash":"03bfaf8715f77a5d214b8e6e19207c649f5d60d5","metric":151.4439,"run":4,"short_hash":"03bfaf8","status":"kept","summary":"HIDDEN_DIM_WIDE=128. Wide net FLOPs ~4x more, same C_u. Ratio 40→151. Major improvement.","timestamp":"2026-04-03T03:10:40.755453+00:00"}
{"delta":432.2713,"hash":"4b5889c9d87b3ac3382fc85482e44fa3b3d0243e","metric":583.7152,"run":5,"short_hash":"4b5889c","status":"kept","summary":"HIDDEN_DIM_WIDE=256. Ratio 151→584. But watch Goodhart — making Wide artificially large is just demonstrating a tautology.","timestamp":"2026-04-03T03:11:37.759238+00:00"}
{"delta":-432.2713,"hash":"579e0fb68a5d580f87a445faeb9a1fd157c2cefd","metric":151.4439,"run":6,"short_hash":"579e0fb","status":"kept","summary":"Reverted WIDE=256 (Goodhart risk). Back to WIDE=128 which is more defensible.","timestamp":"2026-04-03T03:11:46.021171+00:00"}
{"delta":0.7484999999999786,"hash":"0ecd90737c38b52396ae171ebbbfe9518aeca216","metric":152.1924,"run":7,"short_hash":"0ecd907","status":"kept","summary":"LR=3e-3. Marginal improvement 151→152. Both models converge fine at higher lr.","timestamp":"2026-04-03T03:12:37.745638+00:00"}
{"delta":-152.1924,"hash":"790df4d78e4aa8a03338b2d786a564c87f08ddf1","metric":0.0,"run":8,"short_hash":"790df4d","status":"discarded","summary":"N_NOISE=6, BN_hidden=16. Gate fail: A(BN)=0.81. Bottleneck still can't handle extra noise.","timestamp":"2026-04-03T03:13:32.753710+00:00"}
